{
  "$schema": "schemas/scorer-manifest.schema.json",
  "schemaVersion": 1,
  "artifactType": "ScorerManifest",
  "evaluationDesignContractRevision": "retrieval-v2-evaluation-design-v1",
  "status": "frozen-unmaterialised-unscored",
  "authorityId": "AUTH-RB1-EVALUATION-DESIGN-FREEZE-001",
  "createdDate": "2026-08-12",
  "scorerId": "retrieval-evaluation-scorer-v1",
  "formulae": [
    { "metricId": "T_i^5", "definition": "For positive case i, the first five final selected-evidence items." },
    { "metricId": "L_i", "definition": "For positive case i, the non-empty set of eligible grade-2 relevantLocationGroupIds." },
    { "metricId": "SelectedEvidenceRelevantLocationRecall@5_i", "definition": "Grade-2 groups from L_i represented by an association in T_i^5 divided by |L_i|." },
    { "metricId": "SelectedEvidenceMRR@5_i", "definition": "1/rank_i when the first eligible grade-2 item is at rank 1..5; otherwise 0." },
    { "metricId": "RawVectorRelevantLocationRecall@5_i", "definition": "Groups from L_i present in the first five raw hits divided by |L_i|." },
    { "metricId": "RequiredFactGroupCoverage@5_i", "definition": "Required facts with at least one selected grade-2 association divided by all required facts for the case." },
    { "metricId": "SelectedEvidencePrecision@5_i", "definition": "Ranks 1..5 with an eligible grade-2 association divided by 5; absent ranks contribute zero." },
    { "metricId": "DCG@5", "definition": "sum for r=1..5 of (2^grade_r - 1) / log2(r + 1)." },
    { "metricId": "nDCG@5", "definition": "DCG@5 / IDCG@5; zero IDCG produces nDCG=0 only in the separate negative denominator." },
    { "metricId": "canonical-overall-macro", "definition": "Simple arithmetic mean over positive cases." },
    { "metricId": "stratum-macro", "definition": "Simple arithmetic mean over positive cases in that stratum." },
    { "metricId": "semantic-diagnostic-macro", "definition": "Mean across variants within each semanticCaseGroupId, then simple mean across groups." },
    { "metricId": "DigestMatchRate", "definition": "Planned comparisons with an ordered digest identical to the reference divided by all planned comparisons." },
    { "metricId": "FiniteScoreRate", "definition": "Finite scores in raw hits for quality cases divided by all scores in those raw hits." },
    { "metricId": "ExecutionCompleteness", "definition": "Quality cases ending in Succeeded or NoSelectedEvidenceUnderPolicy divided by all frozen quality cases." },
    { "metricId": "JudgementCoverage@5", "definition": "Judged items in final top-five sequences divided by all items in those sequences." },
    { "metricId": "ContractMatrixCoverage", "definition": "Materialised mandatory contract cells divided by 38." },
    { "metricId": "ContractFixturePassRate", "definition": "Fixtures with exact outcome and assertions divided by 38." },
    { "metricId": "LeakageMatrixCoverage", "definition": "Materialised boundary cells divided by 10." },
    { "metricId": "LeakageCaseRate", "definition": "Adversarial cases returning at least one Ineligible item divided by all adversarial cases." },
    { "metricId": "NegativeEmptySelectionRate", "definition": "Negative cases returning NoSelectedEvidenceUnderPolicy divided by all negative cases." },
    { "metricId": "PositiveEmptySelectionRate", "definition": "Positive cases returning NoSelectedEvidenceUnderPolicy divided by all positive cases." },
    { "metricId": "threshold-distance", "definition": "score - 0.25." },
    { "metricId": "nearest-rank-percentile", "definition": "For p50, p95, and p99, the ordered value at position ceiling(p*n), using a one-based index." }
  ],
  "thresholds": [
    { "metricId": "raw-ordered-top-k-DigestMatchRate", "scope": "overall", "operator": "equal", "value": 1.0 },
    { "metricId": "ordered-selected-evidence-DigestMatchRate", "scope": "overall", "operator": "equal", "value": 1.0 },
    { "metricId": "FiniteScoreRate", "scope": "overall", "operator": "equal", "value": 1.0 },
    { "metricId": "ExecutionCompleteness", "scope": "overall", "operator": "equal", "value": 1.0 },
    { "metricId": "JudgementCoverage@5", "scope": "overall", "operator": "equal", "value": 1.0 },
    { "metricId": "ContractMatrixCoverage", "scope": "overall", "operator": "equal", "value": 1.0 },
    { "metricId": "ContractFixturePassRate", "scope": "overall", "operator": "equal", "value": 1.0 },
    { "metricId": "LeakageMatrixCoverage", "scope": "overall", "operator": "equal", "value": 1.0 },
    { "metricId": "LeakageCaseRate", "scope": "overall", "operator": "equal", "value": 0.0 },
    { "metricId": "NegativeEmptySelectionRate", "scope": "overall, each negative subtype, and each questionLanguage", "operator": "greater-than-or-equal", "value": 0.95 },
    { "metricId": "SelectedEvidenceRelevantLocationRecall@5", "scope": "overall", "operator": "greater-than-or-equal", "value": 0.90 },
    { "metricId": "SelectedEvidenceRelevantLocationRecall@5", "scope": "each reportable database, reportable source stratum, and mandatory language row", "operator": "greater-than-or-equal", "value": 0.85 },
    { "metricId": "SelectedEvidenceMRR@5", "scope": "each reportable database, reportable source stratum, and mandatory language row", "operator": "greater-than-or-equal", "value": 0.75 }
  ],
  "diagnosticsWithoutThreshold": ["PositiveEmptySelectionRate", "RawVectorRelevantLocationRecall@5", "RequiredFactGroupCoverage@5", "SelectedEvidencePrecision@5", "nDCG@5", "semantic-diagnostic-macro", "p50", "p95", "p99", "counts", "score-distribution", "threshold-distance"],
  "denominatorRules": ["A zero denominator for a hard rate or mandatory stratum is NOT_EVALUABLE and fails the gate.", "A zero IDCG produces nDCG=0 only for the separate negative denominator."],
  "failureDispositions": ["A positive technical failure contributes zero to Recall and MRR and fails ExecutionCompleteness.", "A negative technical failure never counts as a correct empty selection."],
  "contractFixtureDenominatorPolicy": "contract fixtures are excluded from quality denominators",
  "observedMetricCount": 0
}
